{
  "$schema": "./schema.json",
  "version": "0.8.0",
  "release_date": "2026-09-16",
  "compatibility": {
    "polygres_mcp": {
      "minimum_supported": "1.0.0",
      "maximum_tested": "1.0.0"
    },
    "polygres_cli": {
      "minimum_supported": "0.4.0",
      "maximum_tested": "0.6.0"
    },
    "polygres_sdk": {
      "minimum_supported": "0.4.0",
      "maximum_tested": "0.5.0"
    },
    "codex": {
      "tested": null
    },
    "claude_code": {
      "tested": null
    },
    "skills_cli": {
      "tested": null
    }
  },
  "content_digest": "sha256:22f911389102bb4e6d3f7cd231d6cad3d212cac0e17c25511b39c4159cbbd095",
  "installation_channels_verified": [],
  "behavioral_evaluations": [
    "CLI recovery confirmation, stale versions, ambiguous responses, legacy payloads, and generation/search readiness regression tests",
    "Command documentation and source contract verification"
  ],
  "known_limitations": [
    "New automatic chunking and oversized recovery workflows require CLI 0.6.0 and a compatible server. Existing commands retain older CLI support.",
    "Public package installation and plugin loading are separate publication checks; no public release is claimed."
  ]
}
