{
  "$schema": "./schema.json",
  "version": "0.7.0",
  "release_date": "2026-09-13",
  "compatibility": {
    "polygres_mcp": {
      "minimum_supported": "1.0.0",
      "maximum_tested": "1.0.0"
    },
    "polygres_cli": {
      "minimum_supported": "0.4.0",
      "maximum_tested": "0.5.0"
    },
    "polygres_sdk": {
      "minimum_supported": "0.4.0",
      "maximum_tested": "0.5.0"
    },
    "codex": {
      "tested": null
    },
    "claude_code": {
      "tested": null
    },
    "skills_cli": {
      "tested": null
    }
  },
  "content_digest": "sha256:912be4a903310aa1d230cb277e3e3cab24c1fb26a04f21ce70ff90f1e929fd16",
  "installation_channels_verified": [],
  "behavioral_evaluations": [
    "Individual source review and verification for all five skills",
    "CLI 0.5.0 documented embedding commands and JSON request contracts",
    "SDK 0.5.0 documented text examples executed through existing query methods",
    "Existing vector payloads and query capability checks",
    "Managed model recommendation from the public catalog",
    "Managed plan validation, monetary estimates, and approved processing settings",
    "Standard and synchronized managed setup packs with source writes and text queries",
    "Local and external embedding workflow regression coverage",
    "Retrieval model binding, query plans, and public setup handoffs",
    "Read-only diagnostic command handlers and public embedding error recovery",
    "Current MCP policy catalog coverage and exact generated-reference copies",
    "Release version, manifest, content digest, and temporary export validation"
  ],
  "known_limitations": [
    "Clean-machine installation from the published 0.7.0 repository remains a publication check.",
    "Codex plugin loading, production browser OAuth, and installation consent remain live publication checks.",
    "Verification uses local source contracts and mocked requests; live provider generation and billing were not exercised.",
    "The plugin MCP connection covers accessible projects; fixed-project connections come from the project Connect page."
  ]
}
